{
  "schema_version": 1,
  "id": "proxmox-backup-server",
  "group": "virtualization",
  "version": "4.2-1",
  "architecture": "x86_64",
  "destination": "images/02-virtualization/proxmox-backup-server-4.2-1.iso",
  "menu_alias": "Proxmox Backup Server 4.2-1 대화형 설치",
  "description_ko": "Proxmox 백업 서버용 대화형 설치기이며 대상 디스크를 직접 확인한다.",
  "description_en": "Interactive Proxmox backup-server installer; verify the destination disk manually.",
  "boot_behavior": "interactive-installer",
  "profile_adapter": "none",
  "source": {
    "kind": "locked-download",
    "filename": "proxmox-backup-server_4.2-1.iso",
    "url": "https://enterprise.proxmox.com/iso/proxmox-backup-server_4.2-1.iso",
    "sha256": "2fb299deac3929253712c9c3dfc9237edbe70af83c8848467616b771a1d5453e"
  }
}

